{
  "$schema": "https://json-schema.org/draft/2020-12/schema",
  "$id": "https://synapse.local/contracts/events/sugestao-adaptacao-proposta.schema.json",
  "title": "sugestao-adaptacao-proposta",
  "description": "Evento publicado pelo codegen quando a simulação é inviável por orçamento e o nó de sugestão de adaptação propõe uma alternativa (US03, cenário 1). É a API que grava a versão nova da regra e reabre o ciclo: ela é dona da numeração da versão, do hash canônico e do estado do job. A alternativa ainda não foi simulada neste ponto - a arquitetura exige que ela passe de novo pela geração e pela execução antes de ser mostrada ao usuário. Uma alternativa simulada que também não cabe pode ser seguida de outra proposta, até a terceira tentativa (campo tentativa).",
  "type": "object",
  "required": [
    "job_id",
    "regra_origem_id",
    "resultado_id",
    "representacao"
  ],
  "properties": {
    "job_id": {
      "type": "string",
      "format": "uuid",
      "description": "Identificador do job cuja simulação não coube no orçamento."
    },
    "regra_origem_id": {
      "type": "string",
      "format": "uuid",
      "description": "Versão da regra que foi simulada e não coube. A versão nova nasce derivada dela, em regras.regra_origem_id, que é o que liga a alternativa à regra que ela adapta."
    },
    "resultado_id": {
      "type": "string",
      "format": "uuid",
      "description": "Linha de resultados_simulacao que motivou a proposta. O conteúdo não viaja: os totais que embasaram o cálculo ficam no banco, e é de lá que qualquer conferência os lê."
    },
    "representacao": {
      "$ref": "https://synapse.local/contracts/domain/representacao-regra.schema.json",
      "description": "A regra proposta, inteira e no mesmo formato de regras.nucleo/especificacoes. Vai no corpo, e não por referência, porque ainda não existe linha em regras para apontar - criá-la é justamente o que este evento pede."
    },
    "tentativa": {
      "type": "integer",
      "minimum": 1,
      "maximum": 3,
      "description": "Número da tentativa de taxa nova no job, de 1 a 3. Cada taxa candidata é uma regra alternativa completa, com geração e simulação próprias, porque o percentual é uma constante do código gerado. A primeira é estimada a partir dos totais da simulação na meta; as seguintes refinam a estimativa com os pares de taxa e comissão simulada das tentativas anteriores. O limite é do codegen: quando a terceira tentativa não cabe, ou quando não há como estimar uma taxa, ele publica etapa-alterada com etapa sugestao_adaptacao e status sem_alternativa, e não outra proposta. A API só registra o número com a versão que a proposta cria. Ausente nas propostas publicadas antes de o campo existir, que eram tentativa única."
    }
  },
  "examples": [
    {
      "job_id": "3f2b1c40-0d18-4a51-9f2e-6c1d9a77b021",
      "regra_origem_id": "9c7d3e21-4a6b-4c8d-9e0f-1a2b3c4d5e6f",
      "resultado_id": "5e4d3c2b-1a09-4f8e-8d7c-6b5a49382716",
      "representacao": {
        "nucleo": {
          "vigencia": {
            "inicio": "2025-08",
            "fim": "2025-12"
          },
          "loja": [
            "13"
          ],
          "marca": [
            "10"
          ],
          "cargo": [
            "100"
          ],
          "percentual": 0.0197
        },
        "especificacoes": []
      }
    },
    {
      "job_id": "3f2b1c40-0d18-4a51-9f2e-6c1d9a77b021",
      "regra_origem_id": "6b5a4938-2716-4e5d-8c3b-2a1f0e9d8c7b",
      "resultado_id": "7a6b5c4d-3e2f-4a1b-9c8d-7e6f5a4b3c2d",
      "representacao": {
        "nucleo": {
          "vigencia": {
            "inicio": "2025-08",
            "fim": "2025-12"
          },
          "loja": [
            "13"
          ],
          "marca": [
            "10"
          ],
          "cargo": [
            "100"
          ],
          "percentual": 0.0183
        },
        "especificacoes": []
      },
      "tentativa": 2
    }
  ]
}
